{
  "specification": {
    "standard": "DDT-ENTERPRISE-VALIDATION-RULESET",
    "version": "0.1.0-draft.1"
  },
  "ruleSetId": "ddt.enterprise.ai-decision.rules",
  "ruleSetVersion": "0.1.0-draft.1",
  "profileId": "ddt.enterprise.ai-decision",
  "sufficiencyPolicy": {
    "requiredEvidenceClasses": [
      "AI_INPUT_SNAPSHOT",
      "HUMAN_AUTHORIZATION",
      "MODEL_RELEASE_DESCRIPTOR"
    ],
    "distinctSourcePairs": [
      {
        "leftClass": "AI_INPUT_SNAPSHOT",
        "rightClass": "HUMAN_AUTHORIZATION"
      }
    ],
    "rejectOnConflict": true,
    "successResult": "SUFFICIENT_WITHIN_PROFILE_SCOPE"
  },
  "claimBoundary": "Passing sufficiency rules means only that the exact profile evidence rules were satisfied; it does not establish substantive truth."
}
